{
  "contract": "opera-gateway-event-contract/0.1",
  "package_id": "00000000-0000-0000-0000-0000000003ef",
  "record_type": "correcao",
  "tenant": "dirceu-engenharia",
  "canonical_obra_id": "obra:dirceu-engenharia:galpao-quadruplo-domingos",
  "identity_status": "provisional",
  "channel": {
    "transport": "telegram",
    "channel_account_id": "bot-gateway-test",
    "channel_message_id": "msg-1007",
    "source_message_id": "telegram:bot-gateway-test:msg-1007",
    "edited": false,
    "deleted": false,
    "edited_at": null
  },
  "actor": "operador-alfa",
  "sender_binding": "bound",
  "occurred_at": null,
  "recorded_at": "2026-08-18T14:00:00Z",
  "raw": {
    "content": "Na verdade eram 3 marteletes.",
    "derived_from_audio": false,
    "audio_locator": null,
    "audio_sha256": null,
    "attachments": [],
    "received_at": "2026-08-18T14:00:00Z"
  },
  "interpretation": {
    "version": 1,
    "model_ref": "openai/gpt-5-2026-06-01",
    "interpretation_version": 1,
    "events": [
      {
        "event_id": "00000000-0000-0000-0000-0000000003ef:1",
        "event_type": "ASSET_TRANSFER",
        "entities": [
          {
            "kind": "ativo",
            "display": "martelete",
            "resolved_id": null,
            "candidate_ids": [],
            "resolution_level": "PROVISIONAL",
            "confidence": 0.95
          }
        ],
        "confidence": 0.8,
        "occurred_at_estimated": false,
        "location": null,
        "occurred_at": "2026-08-18T13:30:00Z",
        "payload": {
          "asset_class": "martelete",
          "quantity": 3,
          "unit": "unidade",
          "from": "Domingos",
          "to": "Bar do Índio",
          "responsible": "João",
          "condition_note": null
        }
      }
    ]
  },
  "assessment": {
    "overall_confidence": "HIGH",
    "impact": "HIGH",
    "high_impact_reasons": [
      "baixa/dano relevante de ativo"
    ],
    "confirmation_requirement": "MANDATORY",
    "verdict": "PRECISO_CONFIRMAR"
  },
  "confirmation": {
    "state": "NEEDS_CONFIRMATION",
    "requested_at": "2026-08-18T14:10:05Z",
    "responded_at": null,
    "responded_by": null,
    "expires_at": "2026-08-19T14:10:05Z"
  },
  "routing": {
    "rules_version": "0.1",
    "destinations": [
      {
        "system": "triagem",
        "rule_id": "R-DIR-002",
        "write_spec": {},
        "status": "blocked"
      }
    ]
  },
  "delivery": [],
  "lineage": {
    "parent_package_id": "00000000-0000-0000-0000-000000000001",
    "parent_external_id": null,
    "transformation": "corrected",
    "superseded_by": [],
    "supercedes": []
  },
  "evidence": [],
  "integrity": {
    "serialization": "none",
    "sha256": null,
    "frozen_at": null
  },
  "audit": {
    "received_at": "2026-08-18T14:00:00Z",
    "parsed_at": null,
    "confirmed_at": null,
    "routed_at": null,
    "corrections": [],
    "retries": []
  },
  "created_at": "2026-08-18T14:00:00Z",
  "updated_at": "2026-08-18T14:00:05Z"
}
