{
  "contract": "opera-gateway-event-contract/0.1",
  "package_id": "00000000-0000-0000-0000-0000000003ec",
  "record_type": "evento",
  "tenant": "dirceu-engenharia",
  "canonical_obra_id": "obra:dirceu-engenharia:galpao-quadruplo-domingos",
  "identity_status": "provisional",
  "channel": {
    "transport": "telegram",
    "channel_account_id": "bot-gateway-test",
    "channel_message_id": "msg-1004",
    "source_message_id": "telegram:bot-gateway-test:msg-1004",
    "edited": false,
    "deleted": false,
    "edited_at": null
  },
  "actor": "operador-alfa",
  "sender_binding": "bound",
  "occurred_at": null,
  "recorded_at": "2026-08-18T14:00:00Z",
  "raw": {
    "content": "Comprei cimento.",
    "derived_from_audio": false,
    "audio_locator": null,
    "audio_sha256": null,
    "attachments": [],
    "received_at": "2026-08-18T14:00:00Z"
  },
  "interpretation": {
    "version": 1,
    "model_ref": "openai/gpt-5-2026-06-01",
    "interpretation_version": 1,
    "events": [
      {
        "event_id": "00000000-0000-0000-0000-0000000003ec:1",
        "event_type": "MATERIAL_SALE",
        "entities": [
          {
            "kind": "material",
            "display": "cimento",
            "resolved_id": null,
            "candidate_ids": [
              "mat:scq:cimento"
            ],
            "resolution_level": "PROVISIONAL",
            "confidence": 0.7
          }
        ],
        "confidence": 0.6,
        "occurred_at_estimated": false,
        "location": null,
        "occurred_at": "2026-08-18T13:50:00Z",
        "payload": {
          "material": "cimento",
          "quantity": null,
          "unit": null,
          "cost": null,
          "supplier": null,
          "receipt_ref": null
        }
      }
    ]
  },
  "assessment": {
    "overall_confidence": "MEDIUM",
    "impact": "HIGH",
    "high_impact_reasons": [
      "alteração financeira (sem valor declarado)"
    ],
    "confirmation_requirement": "BLOCKED_ASK",
    "verdict": "PRECISO_PERGUNTAR"
  },
  "confirmation": {
    "state": "NEEDS_CONFIRMATION",
    "requested_at": "2026-08-18T14:00:05Z",
    "responded_at": null,
    "responded_by": null,
    "expires_at": "2026-08-19T14:00:05Z"
  },
  "routing": {
    "rules_version": "0.1",
    "destinations": [
      {
        "system": "smart_cotacoes",
        "rule_id": "R-SCQ-009c",
        "write_spec": {},
        "status": "blocked"
      }
    ]
  },
  "delivery": [],
  "lineage": {
    "parent_package_id": null,
    "parent_external_id": null,
    "transformation": "captured",
    "superseded_by": [],
    "supercedes": []
  },
  "evidence": [],
  "integrity": {
    "serialization": "none",
    "sha256": null,
    "frozen_at": null
  },
  "audit": {
    "received_at": "2026-08-18T14:00:00Z",
    "parsed_at": null,
    "confirmed_at": null,
    "routed_at": null,
    "corrections": [],
    "retries": []
  },
  "created_at": "2026-08-18T14:00:00Z",
  "updated_at": "2026-08-18T14:00:05Z"
}
